"DESCRIPTION","DURATION IN MS","NAME","PARENT SUITE","START TIME","STATUS","STOP TIME","SUB SUITE","SUITE","TEST CLASS","TEST METHOD"
"","5255","Velidate Account Registration","chromium","2026-05-12","passed","2026-05-12","","AccountRegistration.spec.ts","",""
"","1525","Login Test with JSON Data: Valid login","chromium","2026-05-12","passed","2026-05-12","","LoginDataDriven.spec.ts","",""
"","1820","Login Test with JSON Data: Valid login @datadriven","chromium","2026-05-12","failed","2026-05-12","","LoginDataDriven.spec.ts","",""
"","1778","Login Test with JSON Data: Invalid login @datadriven","chromium","2026-05-12","passed","2026-05-12","","LoginDataDriven.spec.ts","",""
"","1537","Login Test with CSV Data: Valid login @datadriven","chromium","2026-05-12","passed","2026-05-12","","LoginDataDriven.spec.ts","",""
"","1468","Login Test with CSV Data: Invalid login @datadriven","chromium","2026-05-12","passed","2026-05-12","","LoginDataDriven.spec.ts","",""
"","1863","User login test","chromium","2026-05-12","passed","2026-05-12","","Login.spec.ts","",""
"","1495","Login Test with JSON Data: Invalid login","chromium","2026-05-12","passed","2026-05-12","","LoginDataDriven.spec.ts","",""
"","5046","Velidate Account Registration-My Details","chromium","2026-05-12","passed","2026-05-12","","AccountRegistration.spec.ts","",""
